title,text,subject,date,label
U.S. says it will take steps after Cambodia's dissolves opposition party,"WASHINGTON (Reuters) - The United States expressed  grave concern  on Thursday about the Cambodian government s decision to dissolve the main opposition party and said Washington will take  concrete steps  in response, according to a White House statement. As a first step, the White House said, the United States will end its support for the Cambodian National Election Committee and its administration of the 2018 national election. ",worldnews,"November 17, 2017 ",1
Britain says expects most EU citizens can stay after Brexit,"LONDON (Reuters) - The British government said on Tuesday that most European Union citizens currently living in Britain will be allowed to remain in the country after Brexit in 2019. Outlining plans for a mass registration program, the Department for Exiting the European Union and the interior ministry said EU nationals will be given a two-year grace period to apply for settled status after Britain leaves the EU. The legal status and rights of EU nationals is one of the thornier issues in Britain s complicated exit from the bloc. There are about 3 million EU citizens living in Britain.  Caseworkers will be able to use discretion when processing applications, meaning they should not be refused for minor technicalities, and the majority would be granted, the departments said in a statement. The cost of an application should be no more than the cost of a British passport and EU citizens will also be given a statutory right of appeal if denied.   We have been clear that safeguarding the rights of EU citizens is our top priority in negotiations,  Brexit minister David Davis said.  We will support everyone wishing to stay to gain settled status through a new straightforward, streamlined system.  ",worldnews,"November 7, 2017 ",1
Transport minister doesn't think Britain will leave EU without a deal,"LONDON (Reuters) - British transport minister Chris Grayling said on Sunday he didn t think Britain would leave the European Union without a negotiated deal with the bloc. Negotiations are deadlocked between Prime Minister Theresa May s government and the EU on securing a divorce settlement and agreement on future relations, raising the prospect that Britain could walk away from talks without a deal.  I don t think we ll get to that position,  Grayling, a leading campaigner for  Leave  at least year s referendum, told the BBC when asked what the consequences of leaving without a deal would be. Grayling also said he thought there was no danger of Brexit stopping airlines being able to fly into and out of the country. He said he believed Britain would end up remaining a member of the European Aviation Safety Agency, which oversees safety legislation.  I m of the view that at the end of the negotiations I would expect that to be the case,  he said when asked whether Britain would remain a member of the organization. ",worldnews,"October 15, 2017 ",1
California poised to shut out Republicans from U.S. Senate race,"SACRAMENTO, Calif. (Reuters) - California voters on Tuesday were poised to choose two Democrats to face off against each other in the race to succeed Barbara Boxer in the U.S. Senate, shutting out Republicans in a sign of diminished support in America’s most populous state. State Attorney General Kamala Harris and U.S. Representative Loretta Sanchez will meet in what would be the state’s first single-party Senate election under a 2010 California law advancing the top two primary vote-getters to the general election, regardless of party affiliation. With 16 percent of precincts reporting in early returns on Tuesday, Harris, 51, led the crowded field of 34 candidates with 40 percent of the vote. None of the Republican contenders came close to Sanchez, 56, who was firmly in second place with 16  percent of the vote. Boxer, 75, a Democrat, is retiring after 24 years in the Senate. Republicans hold no statewide offices in California and represent about 27 percent of registered voters. The state, home to former Republican Presidents Richard Nixon and Ronald Reagan, last elected a Republican to the U.S. Senate in 1988. On Tuesday, former California Republican Party chairman Duf Sundheim was in third place with 10 percent in early returns, followed by fellow Republican Phil Wyman with 6 percent.       Harris is the daughter of two college professors. Of African-American and Indian descent, she was raised amid civil rights activism in Berkeley and Oakland, eventually becoming a prosecutor in San Francisco. She was elected attorney general in 2010 and 2014. For the primary, Harris ran a tightly controlled campaign, touting her role negotiating a settlement with big banks over the mortgage meltdown and using her position as the state’s top prosecutor to fight human trafficking, cyber crime and other issues. Sanchez, who represents Orange County near Los Angeles, has served in Congress since 1997. Her win in the once staunchly Republican county was an early sign of California’s demographic shift, as the state became more ethnically diverse and far more Democratic. Such a matchup could easily go negative, experts said, straining relationships within a party that are already bruised by the tense competition between former Secretary of State Hillary Clinton and U.S. Senator Bernie Sanders for the Democratic presidential nomination for the Nov. 8 election. Clinton and Sanders also face off in California on Tuesday. “The fact that they’re both in the same party doesn’t mean they’re going to treat each other with kid gloves,” political analyst Sherry Bebitch Jeffe said of Harris and Sanchez. “When ideological and policy differences aren’t as great, it’s only natural for the candidates to focus on personal issues,” said Dan Schnur, who heads the Unruh Institute of Politics at the University of Southern California. Sanchez, seeking to become the state’s first Latina U.S. senator, has raised less money than Harris and trails her by about 8 percentage points in polls. But factors including a recent surge in voter registration among Latinos will make her a strong competitor in the general election, analysts said. She has positioned herself more to the political center than her opponent. With support from Latinos, independents and Republicans, Sanchez could win in November despite Harris’ advantages, Schnur said. “We’re prepared for any turn in the race,” said Harris spokesman Nathan Click. A Sanchez campaign spokesman did not respond to a request for comment. ",politicsNews,"June 7, 2016 ",1
DIRTY POOL! FBI AND DOJ Just Affirmed They Spied On Trump WITHOUT Proving Dossier’s Authenticity,"How dirty is this? The powers-that-be at the intelligence agencies didn t follow the proper channels before opening up spying on the Trump campaign! They needed proof that the Trump dossier is authentic but never received that proof. They moved forward with the spying anyway! What dirty rats these Democrats are!FBI and Justice Department officials have told congressional investigators in recent days that they have not been able to verify or corroborate the substantive allegations of collusion between Russia and the Trump campaign outlined in the Trump dossier.The FBI received the first installment of the dossier in July 2016. It received later installments as they were written at the height of the presidential campaign, which means the bureau has had more than a year to investigate the allegations in the document.The dossier was financed by the Hillary Clinton campaign and compiled by former British spy Christopher Steele.An August 24, 2017 subpoena from the House Intelligence Committee to the FBI and Justice Department asked for information on the bureau s efforts to validate the dossier. Specifically, the subpoena demanded  any documents, if they exist, that memorialize DOJ and/or FBI efforts to corroborate, validate, or evaluate information provided by Mr. Steele and/or sub-sources and/or contained in the  Trump Dossier. According to sources familiar with the matter, neither the FBI nor the Justice Department has provided documents in response to that part of the committee s subpoena. But in face-to-face briefings with congressional staff, according to those sources, FBI and DOJ officials have said they cannot verify the dossier s charges of a conspiracy between the Russian government and the Trump campaign.Read more: WE",politics,"Nov 20, 2017",0
[VIDEO] WHAT JERRY SEINFELD HAS TO SAY ABOUT OVERLY PC COLLEGE KIDS WILL MAKE THE LEFT CRAZY,"Kids Just Want To Use Words  That s racist, that s sexist.  They don t even know what they re talking about Like Chris Rock and Larry the Cable Guy, Jerry Seinfeld avoids doing shows on college campuses. And while talking with ESPN s Colin Cowherd on Thursday, the comedian revealed why: College kids today are too politically correct. I hear that all the time,  Seinfeld said on The Herd with Colin Cowherd.  I don t play colleges, but I hear a lot of people tell me,  Don t go near colleges. They re so PC. Seinfeld says teens and college-aged kids don t understand what it means to throw around certain politically-correct terms.  They just want to use these words:  That s racist;   That s sexist;   That s prejudice,  he said.  They don t know what the f k they re talking about. The funnyman went on to recount a conversation he and his wife had with their 14-year-old daughter, which he believes proved his point. My wife says to her,  Well, you know, in the next couple years, I think maybe you re going to want to be hanging around the city more on the weekends, so you can see boys,  Seinfeld recalled.  You know what my daughter says? She says,  That s sexist. https://youtu.be/zP769IdU_YECowherd pointed out the flack comedian Louis C.K. received after his controversial appearance on Saturday Night Live last month, further proving Seinfeld s point. Louis  great gift is that he doesn t worry, he just does his thing,  he said. And Seinfeld s not scared to make his point, either:  If I wanted to say something, I would say it. But for now, Seinfeld will stick to covering the topics he can feels he can make humorous, PC or not.  I talk about the subjects I talk about because for some reason I can make them funny,  he said.  The ones I can t make funny, you don t hear. Via: Entertainment Weekly",politics,"Jun 8, 2015",0
BREAKING: OBAMACARE REPEAL Clears First Hurdle…Dems Get Snarky,"The Senate voted 51-48 this afternoon to proceed to the resolution, S. Con. Res. 3, which would set up a filibuster-proof process, ensuring the chamber s consideration of legislation repealing parts of Obamacare and replacing it, either as one bill or as separate measures.The 54-page document, unveiled yesterday by Budget Chairman Mike Enzi, directs committees of jurisdiction to come up with Affordable Care Act legislation by Jan. 27, meaning a repeal bill could be to Donald Trump s desk by the end February, lawmakers said today.The House Ways and Means and Energy and Commerce as well as the Senate Finance and Health, Education, Labor, and Pensions committees are charged with drafting the legislation.Senate action came as Obama and Pence both headed to the Capitol to meet with their respective parties to discuss efforts to preserve or undo the health-care law. House Ways and Means Chairman Kevin Brady of Texas said that an Obamacare replacement proposal would be laid out on a step-by-step basis and could be fully written by the August recess.The Obama administration immediately hit back with the comment that the Senate vote was passed by a  pretty narrow margin Josh Earnest went on to say that the Republicans will be responsible for the ensuing chaos LOL! Via: ZH",politics,"Jan 4, 2017",0
"At G20 summit, Trump pledges $639 million in aid to four countries","HAMBURG (Reuters) - U.S. President Donald Trump on Saturday promised $639 million in aid to feed people left starving because of drought and conflict in Somalia, South Sudan, Nigeria and Yemen. Trump’s pledge came during a working session of the G20 summit of world leaders in Hamburg, providing a “godsend” to the United Nations’ World Food Programme, the group’s executive director, David Beasley, told Reuters on the sidelines of the meeting. “We’re facing the worst humanitarian crisis since World War Two,” said Beasley, a Republican and former South Carolina governor who was nominated by Trump to head the U.N. agency fighting hunger worldwide. The new funding brings to over $1.8 billion aid promised by the United States for fiscal year 2017 for the crises in the four countries, where the United Nations has estimated more than 30 million people need urgent food assistance. “With this new assistance, the United States is providing additional emergency food and nutrition assistance, life-saving medical care, improved sanitation, emergency shelter and protection for those who have been affected by conflict,” USAID said in a statement. Rob Jenkins, acting head of the USAID’s bureau of democracy, conflict and humanitarian assistance, said of the funding, over $191 million would go to Yemen, $199 million to South Sudan, $121 million to Nigeria and almost $126 million for Somalia. Conflict in all four countries had made it difficult to reach some communities in need of food, he noted. “We’re in a dire situation right now,” said Jenkins, adding that USAID was also concerned with the situation in southern Ethiopia. “The situation in southern Ethiopia fortunately does not rise to the dire situation of the other four, but the situation is deteriorating and might very well be catastrophic without additional interventions,” he said, adding that Washington had already provided some $252 million this year to Ethiopia, “but the needs continue to grow.” Beasley said the U.S. funding was about a third of what the WFP estimated was required this year to deal with urgent food needs in the four countries in crisis as well as in other areas. The WFP estimates that 109 million people around the world will need food assistance this year, up from 80 million last year, with 10 of the 13 worst-affected zones stemming from wars and “man-made” crises, Beasley said. “We estimated that if we didn’t receive the funding we needed immediately that 400,000 to 600,000 children would be dying in the next four months,” he said. Trump’s announcement came after his administration proposed sharp cuts in funding for the U.S. State Department and other humanitarian missions as part of his “America First” policy. Beasley said the agency had worked hard with the White House and the U.S. government to secure the funding, but Trump would insist that other countries contributed more as well. A WFP spokesman said Germany recently pledged an additional 200 million euros for food relief. ",politicsNews,"July 8, 2017 ",1
 Everyone Is Freaking Out Over This ‘Visitor’ At A Bernie Sanders Rally (VIDEO/TWEETS),"People are freaking out all over the internet over a winged  intruder  at a Bernie Sanders rally in Portland. In the middle of Sander s speech, a small and beautiful bird floated down and joined him on the podium.This is not some Matthew Bay-level CGI effect   it actually happened. Sanders broke off mid-speech as the bird hovered around above him, and the packed stadium laughed and applauded. But then, to everyone s surprise, the bird actually flew down and settled on the lectern. I think there s some symbolism here,  Sanders said.  That little bird is really a dove asking us for world peace. This sent the crowd into uproar, and the meme-makers went into overdrive.There was some speculation about what would have happened to the poor bird if it had innocently flapped its way into a Trump rally.@politico If this was a Trump rally.. his goons would beat it up or one of the cult members would shoot it  Greg King (@Megreg916) March 25, 2016And the whole affair is certainly not going to help Portland rid itself of the Portlandia gag #PutABirdOnIt.A little bird told me that @BernieSanders is really a Disney Princess.Also Portland you're taking that #PutABirdOnIt thing way too serious  kelly kapowski (@Colo_Kelly) March 25, 2016For those who missed that joke. Sketch show Portlandia, which satirizes the uber-liberal Oregon city, made it famous with this skit.It didn t take long for the sparrow to become the patron saint of the #FeelTheBern movement, who even honored it with a name. They continued to praise it at the puntastic hashtag #BirdieSanders.My cynicism for all things political dims in response to #BirdieSanders  J. Wolff Hughes (@JWOLFFH) March 25, 2016Even birds love him  Make this man the President of the United States already. #BirdieSanders pic.twitter.com/RmclxLyiUr  Rebekah Lopez (@BekahLeee) March 25, 2016Peeps a vote for Bernie is a vote for #BirdieSanders. Say  owl caucus tomorrow."" Toucan make a difference #LeftWing https://t.co/mKb7HwaDvB  Billy (@billy_gendell) March 25, 2016Or as Obama would say: Yes Toucan.The news even made it international, with prominent British activists sharing their one disbelief.Omg!!! What!!. pic.twitter.com/0vvicZmLcO @JolyonMaugham  ARTIST TAXI DRIVER (@chunkymark) March 25, 2016This has literally lit up the internet with even conservative-edged The Hill feeling the need to pass comment. Amid all the hullaballoo   Sanders himself remained entertained and humble about the whole thing. The candidate hinted at further partnership with Birdie Sanders, perhaps a potential running mate should he defeat Hillary in the primaries?#BirdieSanders and I are on our way to our rally in Seattle at Safeco Field. Meet us there: https://t.co/eJGkfGsA5M pic.twitter.com/05LhBpMrne  Bernie Sanders (@BernieSanders) March 25, 2016And with that Bernie Sanders heads to Seattle, home of the $15 minimum wage, to continue his battle to overcome Hillary Clinton for the Democratic nomination.Featured Image via Screengrab",News,"March 25, 2016",0
‘SLEEPY’ JUSTICE GINSBURG: Excites Crowd By Saying She’d Back Abolition Of The Electoral College [Video],So much for the SCOTUS not being political Check out her comments on equality for women. It s like she s time traveled back to the 50 s. What is the deal with these women that think we re still in the dark ages!,left-news,"Feb 7, 2017",0
 It’s Mueller Time!: Russia Probe Just Got Worse For Trump And It’s Going To Hurt,"Justice Department deputy solicitor general Michael Dreeben will assist Robert Mueller and he s no slacker. He has argued more than 100 cases before the U.S. Supreme Court so his resume is worthy of joining the investigation into possible coordination between Trump s associates and Russian officials. Donald Trump had better stock up on aspirin because team Mueller is going to be all up in his business. The move signals that Mueller may be seeking advice on complex areas of criminal law, including what constitutes obstruction of justice and that has been an issue of debate for a while now. Most recently, when former FBI Director James Comey testified Thursday.Dreeben is the department s go-to lawyer on criminal justice cases and is highly respected by Democrats and Republicans alike due to his encyclopedic knowledge of criminal law, according to the Washington Post.Dreeben has been pulled into the investigation to work part time for Mueller while he continues to oversee the department s criminal appellate cases, according to Justice officials.According to former and current Justice Department officials, Mueller s recruitment of Dreeben into the probe shows how serious he is about the investigation and signals complexities in the investigation.Dreeben is thought of as brilliant in his area of expertise:Michael is the most brilliant and most knowledgeable federal criminal lawyer in America   period,  said Walter Dellinger, a law professor at Duke University School of Law and acting solicitor general for the 1996-1997 term of the Supreme Court. I learned early on in my time as acting [solicitor general] that there was no point of ever thinking of second-guessing Michael on a matter of federal criminal law because he just knew more than I did or could ever know,  Dellinger said.  He s a straight shooter, and is held in the greatest esteem by the FBI and lawyers in U.S. attorneys offices all over the country. It s not just Dreeben:Mueller s team includes Jeannie Rhee, a former deputy assistant attorney general and a partner in the investigations practice at WilmerHale, and Andrew Weissmann, the chief of the Justice Department s fraud section who oversaw corruption investigations including the probe into cheating by Volkswagen on diesel emissions tests over.Aaaand, Trump s lawyer can t even spell  President  so that s kind of sad, don t you think? Marc Kasowitz, Trump s life-long personal attorney, issued a statement to refute Comey s testimony. The only problem is that it was riddled with errors, including the spelling of  President.  Spelling is HARD.Trump better lawyer up but hire someone more effective because it s Mueller Time!Featured image via Drew Angerer/Getty Images",News,"June 9, 2017",0
One dead after light aircraft collides on Caernarfon runway,"(Reuters) - British Police said that one person died after a light aircraft collision at Caernarfon Airport in Wales on Thursday. The police said in a Facebook post that the pilot of the aircraft had died after it collided on the runway and caught fire.   A cordon is in place around the site and we are urging the public to remain clear of the area to allow the emergency services to deal with the incident,  Sharon McCairn , Chief Inspector for North Wales Police said. ",worldnews,"September 6, 2017 ",1
"PM May's deputy to keep job after pornography claims, ITV says","LONDON (Reuters) - Prime Minister Theresa May s senior minister will not have to resign over claims that police found pornography on a work computer and that he made an inappropriate sexual advance against a young woman, ITV political editor Robert Peston said on Monday. First Secretary of State Damian Green will be told on Wednesday that the Cabinet Office and the prime minister will inform him that he can keep his job, Peston said on his Facebook page. May s office declined to comment on the report. Peston said no other women came forward to present evidence against Green and that police testimony does not prove he watched the porn on the parliamentary computer. Two retired police officers alleged the pornography was discovered on Green s computer by officers during an inquiry into government leaks in 2008. Earlier on Monday, a spokesman for the prime minister said there are procedures to go through in the investigation and once they are complete the government will publish the findings.  Green, who is a close ally of May, has denied the allegations. If Green is cleared it would be a boost to the prime minister after she lost two ministers last month: one was forced to quit in a sexual harassment scandal and another over undisclosed meetings with Israeli officials. ",worldnews,"December 11, 2017 ",1
Michigan governor expects no charges over Flint crisis: newspaper,"(Reuters) - Michigan Governor Rick Snyder said he had “no reason to be concerned” he would be charged in connection with the Flint drinking water crisis that exposed city residents to high levels of lead, the Detroit Free Press reported on Thursday.   Snyder made the comments to the newspaper on Wednesday, the day after two Flint emergency managers appointed by the governor were indicted on felony charges of conspiring to violate safety rules. “I have no reason to be concerned,” Snyder was quoted as saying, while acknowledging he could not speak on behalf of state Attorney General Bill Schuette. Both Snyder and Schuette are Republicans. Snyder told the paper much of the $3.5 million in taxes he is using for his criminal defense was being spent to find and prepare records requested by Schuette and the U.S. Attorney’s Office, which is also investigating the water scandal. Schuette has filed 43 criminal charges against 13 current and former state and local officials, including the emergency managers this week. Snyder’s office did not immediately respond to requests for comment on the interview. Flint has been at the center of a public health crisis since last year, when tests found high amounts of lead in blood samples taken from children in the poor, predominantly black city of about 100,000 residents. Critics have called for charges to be brought against the governor, who has been in office since 2011, as well as other high-ranking state officials. Snyder has said he believes he did nothing criminally wrong. Asked at a news conference on Tuesday whether the investigation would lead to charges against senior state officials, Schuette said no one was excluded from the probe.  Flint’s water contamination was linked to a switch of its source to the Flint River from Lake Huron in April 2014, a change made in an attempt to cut costs, while the city was under state-run emergency management.  ",politicsNews,"December 22, 2016 ",1
