title,text,subject,date,label
South Africa's Ramaphosa steps up criticism ahead of ANC leadership vote,"JOHANNESBURG (Reuters) - South African Deputy President Cyril Ramaphosa, a leading contender to become head of the ruling ANC in December, stepped up his criticism of the government on Sunday, saying state-owned companies had been  captured  and funds looted from them. Ramaphosa s remarks during a speech to an African National Congress meeting in the old diamond-mining town of Kimberley  were tougher than others he has made on government graft, signaling the issue will be a main theme of his campaign.  He also took aim   without naming them - at the wealthy Gupta family, friends of President Jacob Zuma who have been accused of using undue influence to win lucrative state contracts. Zuma and the Guptas have denied any wrongdoing.  Many of these state-owned enterprises have been captured by certain people, by a certain family,  Ramaphosa said.   All of our state-owned enterprises have been captured and we are saying we want to see an end to state capture and the money that has been stolen, we want it back,  he said, to roars of approval from the audience.  South Africa s top prosecutor said on Wednesday police were examining a trove of leaked documents detailing relations between the Guptas and Zuma, but it was too early to say if a prosecution should be launched. Ramaphosa said in May that South Africa was in danger of becoming a  mafia state  and he took a swipe in July at the Guptas over media reports that state funds were diverted in 2013 to pay for a lavish Gupta family wedding. But Sunday s remarks about a  certain family  were more pointed and come as the race heats up for the ANC s top spot. The next head of the party, who will be selected in December, will be its presidential candidate in 2019 national elections. Ramaphosa s main challenger, veteran politician and Zuma s ex-wife Nkosazana Dlamini-Zuma, will next week be sworn in as a member of parliament, a move which could see the former minister brought back into the cabinet, raising her profile. Analysts say she has the backing of Zuma s well-established patronage network as well as organizations such as the party s Women s League. Ramaphosa is a trade unionist-turned-business tycoon who has the backing of a diverse group of unions, communists and investors who do not always see eye to eye but want to rid the ANC of Zuma s influence and legacy.  The opposition has long accused Zuma of sleaze and influence-peddling while in office. He survived a no-confidence vote in parliament on Aug. 8 but 30 ANC lawmakers voted with the opposition, indicating deep divisions in the party that has dominated South African politics since the end of apartheid in 1994. ",worldnews,"September 10, 2017 ",1
 Anthony Bourdain Reveals The ‘ONE Good Thing’ About Trump And It’s HILARIOUS,"While Donald Trump is currently freaking out because he hasn t been able to find anyone to perform at his inauguration (which is just a few short weeks away at this point), master chef Anthony Bourdain is making sure he rubs salt in Trump s open wounds.Never one to mince his words, Bourdain first asserted himself as an anti-Trump celebrity when he was asked if he d ever dine with Trump during his presidential campaign. Bourdain s reply was blunt and brutal   he said, Absolutely f*cking not. And Bourdain hasn t changed his tone about Trump, not even after the phony business mogul has been elected. In a recent interview with Eater s Helen Rosner, Bourdain further confirmed that he is as anti-Trump as ever. During the interview, Bourdain clearly stated that he was concerned about what Trump s presidency meant for his daughter   rightfully so, as any parent should be. But while Trump s presidency means horrible things for many people who aren t rich white men, Bourdain was able to find one silver lining.In stating that he would never attend Trump s White House Correspondents  dinner, Bourdain stated that at least Trump would probably put an end to it. He said: I doubt there will be another. Thank god, that s an institution I d like to see die for years. If there s one good thing to come out of the Trump administration, let it be that there will be no more White House Correspondents  dinners. It reinforces all the world s worst notions about the hideous, inside-the-beltway, all-in-it-together culture. It brings honor to no one to have Kim Kardashian or Tara Reid sitting there next to a news anchor. What is this all about? F*ck that. If I m gonna make fun of you today, I m not accepting your food tomorrow. I had dinner with President Obama, but I paid. We were offered Air Force One, and I said,  There s no way. No way. Well, he s probably right. Not only would there be several empty seats, but the only people who would actually attend would be swamp monsters just like Trump. This is surely going to be one sour reminder to Trump that he is extremely unpopular and will never be accepted in the way that President Barack Obama was embraced by most of America. You can read the rest of Bourdain s anti-Trump interview on Eater.Featured image via Astrid Stawiarz / Getty Images",News,"December 22, 2016",0
Factbox: Short list of potential picks for Trump administration,"(Reuters) - New candidates to serve in U.S. President-elect Donald Trump’s Cabinet emerged on Wednesday, including U.S. Senator Ted Cruz as a potential attorney general and North Carolina Governor Nikki Haley as secretary of state, as he works to fill administration positions ahead of his inauguration on Jan. 20. Trump said on Sunday he would hire Republican National Committee Chairman Reince Priebus as White House chief of staff and named Stephen Bannon, former head of the conservative website Breitbart News, as his chief strategist and senior counselor. Below are people mentioned as contenders for senior roles. * Steven Mnuchin, former Goldman Sachs Group Inc executive and Trump’s campaign finance chairman * Jeb Hensarling, U.S. representative from Texas and chairman of the House Financial Services Committee * Jamie Dimon, JPMorgan Chase & Co chief executive officer * Tom Barrack, founder and chairman of Colony Capital Inc * Rudy Giuliani, former mayor of New York City * Nikki Haley, governor of South Carolina  * John Bolton, former U.S. ambassador to the United Nations under President George W. Bush * Bob Corker, U.S. senator from Tennessee and chairman of the Senate Foreign Relations Committee * Newt Gingrich, former U.S. House of Representatives speaker * Zalmay Khalilzad, former U.S. ambassador to Iraq * Jeff Sessions, U.S. senator from Alabama and early Trump supporter, member of the Senate Armed Services Committee * Tom Cotton, U.S. senator from Arkansas       * Retired Lieutenant General Michael Flynn, former director of the Defense Intelligence Agency  * Jon Kyl, former U.S. senator from Arizona * Duncan Hunter, U.S. representative from California and early Trump supporter, member of the House Armed Services Committee * Jim Talent, former U.S. senator from Missouri who was on the Senate Armed Services Committee  * Kelly Ayotte, outgoing U.S. senator from New Hampshire and member of the Senate Armed Services Committee * Rudy Giuliani * Ted Cruz, U.S. senator from Texas * Jeff Sessions, senior member of the Senate Judiciary Committee who takes a hard line on immigration * Kris Kobach, Kansas secretary of state, architect of anti-immigration efforts who says he is advising Trump on immigration issues * Pam Bondi, Florida attorney general  * Trey Gowdy, U.S. representative from South Carolina who headed the House committee that investigated the 2012 attacks on the U.S. mission in Benghazi, Libya * Chris Christie, New Jersey governor * Henry McMaster, lieutenant governor of South Carolina * Newt Gingrich * Tom Price, U.S. representative from Georgia who is an orthopedic surgeon * Rick Scott, Florida governor  * Rich Bagger, former pharmaceutical executive and former top aide to New Jersey Governor Chris Christie * Bobby Jindal, former Louisiana governor * Michael McCaul, U.S. representative from Texas and chairman of the House Homeland Security Committee * David Clarke, Milwaukee county sheriff and vocal Trump supporter  * Joe Arpaio, outgoing Maricopa County, Arizona, sheriff who campaigned for Trump  * Jeff Holmstead, energy lawyer, former EPA official during George W. Bush administration * Mike Catanzaro, energy lobbyist, former EPA official during George W. Bush administration * Robert Grady, venture capitalist, partner in private equity firm Gryphon Investors  * Leslie Rutledge, Arkansas attorney general * Carol Comer, commissioner of the Indiana Department of Environmental Management * Harold Hamm, Oklahoma oil and gas mogul, chief executive of Continental Resources Inc * Kevin Cramer, U.S. Representative from North Dakota * Robert Grady * Larry Nichols, co-founder of Devon Energy Corp * James Connaughton, chief executive of Nautilus Data Technologies and a former environmental adviser to President George W. Bush * Sarah Palin, former Alaska governor, 2008 Republican vice presidential nominee * Jan Brewer, former Arizona governor * Forrest Lucas, founder of oil products company Lucas Oil * Harold Hamm * Robert Grady * Wilbur Ross, billionaire investor, chairman of Invesco Ltd subsidiary WL Ross & Co * Linda McMahon, former world Wrestling Entertainment executive and two-time Senate candidate * Retired Lieutenant General Ronald Burgess, former Defense Intelligence Agency chief  * Robert Cardillo, director of the National Geospatial-Intelligence Agency * Pete Hoekstra, former U.S. representative from Michigan * Retired Lieutenant General Michael Flynn * Pete Hoekstra * Michael Flynn * Stephen Hadley * Kelly Ayotte * Richard Grenell, former spokesman for the United States at the United Nations  * Peter King, U.S. representative from New York * Dan DiMicco, former chief executive of steel producer Nucor Corp * Jeff Miller, retiring U.S. representative from Florida and chairman of the Veterans Affairs committee The Trump transition team confirmed he would choose from the list of 21 names he drew up during his campaign, including U.S. Senator Mike Lee of Utah, and William Pryor, a federal judge with the 11th U.S. Circuit Court of Appeals.  ",politicsNews,"November 17, 2016 ",1
" Paul Ryan Sharpens His Backstabbing Knife, Prepares War With White House (VIDEO)","During Donald Trump s meltdown during his rally in Phoenix Tuesday evening, he threatened to shut down the government unless Congress funds his border wall. The former reality show star launched a rant which was so insane that people are starting to question whether he s fit to hold office. We re pretty sure that House Speaker Paul Ryan is wondering that, too, after Trump s screamy-ragey speech.On Wednesday, House Speaker Paul Ryan (R-WI) said he doesn t  think a government shutdown is necessary,  however, we ve noticed that when the Republican leader says something in stark contrast to Trump s rhetoric, he never says it to his face. Like, for example, when he tweeted his denouncement of the Nazis who marched in Trump s name in Charlottesville, Virginia, with one of them murdering Heather Heyer, 32, and injuring 19 others, he failed to tag @RealDonaldTrump.But anyway, Ryan said during a press conference in Hillsboro, Oregon,  I don t think a government shutdown is necessary, and I don t think most people want to see a government shutdown, ourselves included. Ryan continued to say that  Congress in the House has already done its work on this issue  and left it up to the Senate. Given the time of year it is, and the rest of the appropriations we have to do, we re going to need more time to complete our appropriations process, particularly in the Senate,  he said.Talking Points Memo reports:Trump on Tuesday night suggested he would push to tie funding for his proposed border wall to a government spending bill Congress must pass in the fall to avert a shutdown. I don t think anyone s interested in having a shutdown. I don t think it s in our interest to do so,  Ryan added.  I don t think you have to choose between the two. Watch:.@SpeakerRyan: ""I don't think a government shut down is necessary, and I don't think most people want to see"" one. https://t.co/9ZBdrCglu6 pic.twitter.com/ClqY5NAABp  This Week (@ThisWeekABC) August 23, 2017Perhaps Ryan should have  a sit down with Trump and explain to him what happens during a government shutdown. On the other hand, Trump doesn t seem to care about very much. Ryan is trying to distance himself from the very president he supports. He s playing it safe, knowing full well that Trump won t last much longer in office. Ryan wants to come out of the madness with his hands clean so he can say,  Hey, I called Trump out  without actually calling him out. That said, he s going to have a battle on his hands to keep the government open and it looks like he s ready for that. We re certain several of his Republican colleagues would back him up on that.Image via screen capture. ",News,"August 23, 2017",0
"Charlottesville schools, parents address children's fears after violence","CHARLOTTESVILLE, Va. (Reuters) - When white supremacists began rallying in downtown Charlottesville this weekend, Liz Licht kept the TV off, trying  to shield her three kids from the hate spewed on the streets of this normally quiet college town. But after learning that a 32-year-old woman who joined a counter-protest was killed by a man described as having neo-Nazi sympathies, Licht could no longer keep news of the violence from her nine-year-old son and seven-year-old twins. “Our son went to bed scared that night,” Licht said. “He said he never really knew evil existed until that day.” Licht joined other parents to call on the local school district to help Charlottesville children exposed to the hate and violence, especially as they leave the safe haven of home to start the school year.  “We want to work with them to develop buddy systems to pair them up with someone who is an immigrant or refugee,” Licht, 41, said on Tuesday as she stood near a pile of flowers marking the street where Heather Heyer was killed. “Make it hands-on, not just talking about it.” Charlottesville Public Schools officials said they are preparing specific plans on how to address the issue when students return to classes next week. School leaders are tweaking their plans for the new year and preparing teachers to handle students’ questions about the violence and hate speech, schools Superintendent Rosa Atkins said in an e-mail. “If we miss these steps, we will miss an opportunity for healing and growth,” Atkins said. Saturday’s rally was the latest in a series of demonstrations by white supremacists in Charlottesville in recent months. It deteriorated into street fighting that culminated in Heyer’s killing, allegedly by 20-year-old James Alex Field, who injured 19 other people by crashing his car into a counter-protest.  Psychologists often warn that young children can be traumatized by images of violence and urge parents to limit their exposure to news accounts of events like Saturday’s rally. But given the white nationalist ideology that drove the “Unite the Right” event, experts said parents and schools should talk directly with their children about their beliefs. “This is a really important teaching moment,” said Gail Saltz, a clinical associate professor of psychiatry at the Cornell School of Medicine. Schools in particular could use the incident as a way to teach students to cope with bullying, by stepping up to object to bullies, rather than being passive bystanders. “Any way that one can be helpful always relieves anxiety,” said Saltz. “You might say to a child that in your microcosm of school, it’s really important to make everyone feel respected.” Corey Eicher, 42, stopped with his daughters, aged seven and four, to leave flowers at the memorial for Heyer. He said he had tried to soothe his children’s fears by talking about the police and race. “We showed them that a lot of the police working that day were black, of every color,” Eicher said. “My older daughter is seven, so she kind of understands what is happening.” Lila’s reaction to Saturday’s events was brief: “Scary.” ",politicsNews,"August 15, 2017 ",1
Indonesian parliament speaker quits amid graft investigation,"JAKARTA (Reuters) - The speaker of Indonesia s parliament, who is being investigated for his suspected involvement in a $170 million graft scandal, has tendered his resignation, two members of the assembly said on Monday. Setya Novanto was arrested last month over his suspected role in the scandal linked to a national electronic identity card scheme. Anti-corruption investigators then took him into custody from where he sent a letter to assembly leaders pleading to be allowed to keep his job while he fought the charges.  Mr Novanto has resigned,  member of parliament Yandri Susanto told Reuters, referring to a letter in which Novanto announced his decision.  He didn t say why.  A replacement for him as speaker was expected to be decided by his party, Golkar, at an extraordinary meeting on Dec. 19, said Dito Ganinduto, a member of parliament from Novanto s Golkar party. Novanto had not resigned as chairman of Golkar, Ganinduto said. A lawyer for Novanto, Maqdir Ismail, deferred questions on the matter to acting Golkar chairman Idrus Marham. Marham could not be reached for comment. Novanto had clung to power through several previous corruption cases. His latest battle with the graft agency has gripped Indonesia, where newspapers have splashed the story on front pages and social media posts mocking him have been widely shared.  Before his detention last month he had for months declined to answer summonses for questioning by the Corruption Eradication Commission, known by its Indonesian initials KPK. The allegations against Novanto have reinforced the perception among Indonesians that their parliament, long regarded as riddled with entrenched corruption, is a failing institution. Indonesia was ranked last year at 90 out of 176 countries on Transparency International s corruption perception index. The watchdog has singled out parliament as Indonesia s most corrupt institution, and in July called on President Joko Widodo to protect the KPK against attempts by the legislature to weaken the commission s powers. Critics inside and outside the parliament say the root problem is money politics. ",worldnews,"December 11, 2017 ",1
Trump Interior nominee would consider more drilling on federal land,"WASHINGTON (Reuters) - Representative Ryan Zinke of Montana, President-elect Donald Trump’s nominee for secretary of Interior, on Tuesday said he would consider an expansion of energy drilling and mining on federal lands but would ensure sensitive areas remain protected. The former Navy SEAL sought to outline a measured approach to the job of managing America’s national parks, forests and tribal lands during a four-hour Senate confirmation hearing that was mostly cordial, lacking some of the hot-tempered grilling that has marked other sessions to vet Trump’s cabinet nominees. “Yes,” he said in response to a question from Republican Senator Lisa Murkowski of Alaska about whether he would review drilling curbs imposed by President Barack Obama’s administration in her state, home to vast petroleum deposits both onshore and beneath Arctic waters. “I can guarantee you it is better to produce energy domestically under reasonable regulation than overseas with no regulation ... We need an economy.” But he added he was committed to protecting sensitive wildlife habitats and to keeping federal lands under federal control to ensure they are preserved for future generations, so “my granddaughter’s children can look back and say that we did it right.” The Interior Department oversees territories covering a fifth of the United States’ surface from the Arctic to the Gulf of Mexico, including rich deposits of oil, gas and coal and important pasturelands for ranchers. Zinke, an avid hunter and angler, emerged as a surprise pick to head the department in part because he has embraced federal stewardship of public land, diverging from the Republican Party’s official position to sell off acreage to states. But as a congressman he has also fought for increased energy development, a position that has worried conservationists and which fits neatly with Trump’s campaign vows to bolster the U.S. energy sector by scaling back regulation. Over the last eight years, the Interior Department has sought to limit industry access to federal lands and played a key role in Obama’s agenda to combat climate change by curbing greenhouse gas emitting industries. Under Obama, the department banned new coal mining leases on federal property early in 2016. More recently the agency placed parts of the offshore Arctic and Atlantic off-limits to drilling and declared national monuments that protect large parts of Utah and Nevada from development. Zinke said he believed Trump could “amend” Obama’s moves to declare millions of acres of federal property as national monuments. But he said that any move Trump made to rescind a designation would immediately be challenged. He did not comment directly on whether he would seek to reverse Obama’s federal coal-lease ban but said he believed coal plays an important part in the U.S. energy mix and has previously pushed to end the moratorium. Zinke was the first of three Cabinet heads Trump has chosen to oversee his environment and energy portfolio to face Senate scrutiny this week. All three have opposed Obama’s measures to combat global climate change by targeting carbon dioxide emissions. Trump’s pick to lead the Environmental Protection Agency, Oklahoma Attorney General Scott Pruitt, was to testify on Wednesday, and Trump’s choice for Energy secretary, former Texas Governor Rick Perry, was to testify on Thursday. Zinke told committee members that he believes humans contribute to global climate change – a statement that appeared to clash with Trump’s views. Before running for the White House, Trump called climate change a hoax perpetrated by the Chinese to weaken U.S. businesses, a position he has since defended. “I do not think it is a hoax,” Zinke said. But he added that he believed there is still debate over the degree to which humans have an impact, and what should be done about it, adding that regulations could sometimes hurt jobs without helping the environment.  He said, for example, he would support efforts by the U.S. Congress to cancel recent regulation imposed by the Interior Department’s Bureau of Land Management aimed at preventing leaks of methane - another gas scientists blame for climate change - from oil and gas installations. In his opening remarks, Zinke struck a moderate tone, saying that he recognizes that some federal lands require strong protection. He also called himself an “unapologetic admirer of Teddy Roosevelt,” a former Republican president who pioneered public land conservation. Zinke also said he would tackle a multi-billion dollar backlog in maintenance at national parks and promised to ensure greater sovereignty for tribes.",politicsNews,"January 17, 2017 ",1
