title,text,subject,date,label
Co-leader of Germany's far-right AfD to quit in major blow,"BERLIN (Reuters) - Frauke Petry, co-leader of the far-right Alternative for Germany, said on Tuesday she was leaving the party in a major blow to its credibility just two days after it surged to third place in a national election. The anti-immigrant AfD won 12.6 percent of the vote in Germany s election on Sunday, becoming the third-largest group in parliament and the first from the far-right to win seats in the Bundestag since the 1950s.  Petry, the highest-profile figure in the AfD s more moderate wing, had shocked other senior members by saying on Monday she would not sit with the AfD in the Bundestag (lower house) but rather as an independent member of parliament. Her husband, another senior AfD figure, is also leaving the party.   We tried to change course but you have to realize when you reach a point when that is no longer possible,  Petry, a 42-year-old chemist, told reporters in the eastern city of Dresden.  I have five children for whom I am responsible and ultimately you have to be able to look yourself in the mirror.  Petry has clashed with other senior members, arguing for the party to take a more moderate course to make it possible for it to join a coalition government. Her husband, Marcus Pretzell - head of the AfD in the western state of North Rhine-Westphalia (NRW) and also an MP in the European Parliament - is quitting the party and will become an independent MP, a spokesman for the AfD in NRW said. The spokesman said Pretzell and another AfD lawmaker in NRW s regional assembly who is also leaving the party had made the decision for reasons of  personal integrity . On Monday, four of the 17 AfD lawmakers in the assembly of the eastern state of Mecklenburg-Vorpommern announced they were bolting because the party had become more radical. Europe s far-right parties have a history of infighting among their various factions. Marine Le Pen, leader of France s National Front, last week lost her deputy over policy differences.  Alexander Gauland and Alice Weidel, the AfD s top candidates during the election campaign, were elected as chairs of the party s parliamentary group on Tuesday. Gauland is a supporter of Bjoern Hoecke, a senior AfD member who has courted controversy by denying that Adolf Hitler was  absolutely evil  and calling Berlin s Holocaust Memorial a  monument of shame . Weidel was originally an opponent of Hoecke but has not been so critical of him lately. Weidel said she did not expect other lawmakers to quit the party but added:  We ll have to see. The step surprised us all, but there are not yet any trends recognizable in the future parliamentary group.  Senior AfD member Dirk Driesang, who in July founded a moderate group within the AfD called the  Alternative Centre , with which Petry was said to sympathize, told news magazine Der Spiegel that the group could not understand Petry s decision and would not be following in her footsteps. He said the group would continue to fight for the AfD to take a moderate course and added that  a spin-off from the AfD is a stillbirth . Driesang pointed to the example of Bernd Lucke, who founded the AfD then left in 2015 due to what he saw as rising xenophobia and then formed a new, unsuccessful party. Petry was the most recognizable face in the AfD during its swift rise over the past two years. But she said on Monday she could not stand with an  anarchistic party  that lacked a credible plan to govern. For months, Petry has urged the AfD to soften its stance and prepare to join coalition governments, while others wanted the party to stick to opposition. Mainstream parties refuse to work with the AfD. She had also distanced herself from some of the AfD s more radical senior members, saying their comments were putting voters off. Gauland caused a scandal during the election campaign by saying Germans should be proud of their World War Two soldiers. He also said the integration minister should be  disposed of  in Turkey, where her parents come from. As the AfD convened in Berlin on Tuesday for its first parliamentary group meeting, Gauland said discussions in the Bundestag would not echo those of the party s campaign.  It s clear that the talks during the campaign are different to those held in parliament,  he said.   ",worldnews,"September 26, 2017 ",1
ANGRY Venezuelans CHASE Their President…Bang On Pots And Yell [Video],"Scenes from the confrontation late Friday, which also appeared in videos uploaded to social media, captured the attention of Venezuelans, many of whom blame the unpopular president for the country s food shortages.In one video, Mr. Maduro tries to calm the pot-bangers by walking among them, only to be surrounded as the furious crowd yells obscenities. What is this?  an astounded voice behind the camera asks in one of the video clips.Mr. Maduro had traveled from the capital, Caracas, to Margarita Island off Venezuela s northern coast to inaugurate a number of new public housing units and give a televised address.During the speech, he denounced his opponents  calls for his removal from office, calling them  vampires  and saying they were preparing for violence.Foro Penal, a Venezuelan human rights group, said 20 people had been arrested after the protest in the island town of Villa Rosa. Mr. Maduro s office made no statement about the episode.",Government News,"Sep 3, 2016",0
PUTIN ACCUSES U.S. Of Leaking Flight Path Of Russian Plane Shot Down By Turkey…Turkey Buying ISIS Oil,"Countdown until Obama is OUT OF OFFICE: 347 days 8 hours 29 minutes 30 secondsPresident Vladimir Putin said on Thursday that Russia had given prior information to the United States of the flight path of the plane downed by Turkey on the Syrian border. The American side, which leads the coalition that Turkey belongs to, knew about the location and time of our planes  flights, and we were hit exactly there and at that time,  Putin said at a joint press conference with French counterpart Francois Hollande in the Kremlin. Putin said the Russians had given prior information to the U.S. of the flight path of the plane   but the U.S. had  leaked  the information to Turkey.Ahead of the Hollande talks, Putin and Turkish President Recep Tayyip Erdogan traded barbs, with the Russian leader saying he was waiting for an apology and Erdogan ruling out any such move.President Recep Tayyip Erdogan says Turkey s right to protect its borders must be respected, after the military shot down a Russian plane on the Syrian border for allegedly violating its airspace.Putin on Thursday dismissed as  rubbish  Turkey s claim that it would not have shot down the jet if it had known it was Russian. They [our planes] have identification signs and these are well visible,  Putin said.  Instead of [ ] ensuring this never happens again, we are hearing unintelligible explanations and statements that there is nothing to apologise about. Putin has also accused Turkey of buying oil from the Islamic State jihadist group, whose financing heavily relies on the sale of energy resources.Putin said there was  no doubt  that oil from  terrorist-controlled  territory in Syria was making its way across the border into Turkey. We see from the sky where these vehicles [carrying oil] are going,  Putin said.  They are going to Turkey day and night. These barrels are not only carrying oil but also the blood of our citizens because with this money terrorists buy weapons and ammunition and then organise bloody attacks,  he added.Via: Yahoo",Government News,"Nov 27, 2015",0
U.S. lawmakers propose making it easier to meet auto fuel rules,"WASHINGTON (Reuters) - A bipartisan pair of Michigan lawmakers introduced a bill to make it easier for automakers to comply with federal fuel efficiency requirements, as the Trump administration considers softening standards that require nearly doubling the fuel economy of the U.S. new vehicle fleet by 2025. The proposal, introduced late on Wednesday, would extend the life of fuel economy credits that would currently expire after five years, lift a cap on transferring credits between car and truck fleets and award automakers credits for emissions reductions not measured by existing test procedures. The measure proposed by Representatives Fred Upton, a Republican, and Debbie Dingell, a Democrat, would also grant an industry wish by requiring that the Environmental Protection Agency and the National Highway Traffic Safety Administration reconcile their respective fuel economy standards so the industry can comply with just one set of rules. The proposal comes on the heels of a bipartisan measure to create a single federal standard for self-driving cars, also backed by the industry, that is on track to passage.  The Union of Concerned Scientists said the harmonization legislation and a similar bill introduced in the Senate would allow manufacturers to make vehicles that are on average 3 miles a gallon less efficient in 2021. The group estimated that would result in additional U.S. oil consumption of 350 million barrels of oil, costing drivers $34 billion and an additional 155 million metric tons of greenhouse gases. The Alliance of Automobile Manufacturers, a trade group representing General Motors Co, Toyota Motor Corp, Volkswagen AG (VOWG_p.DE) and others, praised the bill for “recognizing the consumer benefits that can come from better alignment of government programs.” The group noted there were significant differences between how the EPA and NHTSA award and allow use of credits. Last week, automakers told U.S. regulators they should revise fuel efficiency mandates because the standards do not reflect how cheap gas prices are affecting consumer demand. Automakers want changes in the 2021-2025 requirements that would make it easier for them to comply with fuel economy standards. Former President Barack Obama’s administration finalized rules in 2012 to double the fleetwide average fuel economy to 54.5 miles per gallon by 2025, but the EPA revised the target to 51.4 mpg based on rising truck sales. The Obama administration said the rules would save motorists $1.7 trillion in fuel costs but cost the auto industry about $200 billion over 13 years ",politicsNews,"October 12, 2017 ",1
 Why This Attorney General Is Going After Trump For ‘Fraud’,"New York Attorney General Eric Schneiderman isn t going to allow Donald Trump s 2016 presidential campaign get in the way of his ongoing prosecution of the GOP frontrunner for  fraud. Schneiderman is the highest profile government official looking into Trump s shady business dealings at Trump University. Customers claim that after they signed up for the opportunity, they were pressured to spend ever-increasing amounts of money with little knowledge of the real estate business to show for it.In an interview with ABC, the attorney general explained that he s not going to back off. We re ready to go,  Schneiderman, a Democrat, told ABC News today.  We sued him long before anyone thought he might run for President. This is not a political case, it s just a straight-up fraud case. Like the judge also looking into the case, Scneiderman has come in for attack by Trump, who has used his high profile to impugn the prosecutor s motives. But that hasn t dissuaded the prosecutor.Schneiderman told ABC News he is not worrying about the confluence of the campaign and his case. The documents, he said only served to offer further proof that the operation was aimed less at teaching students the skills needed to buy and sell real state, and more about making money for Trump. It was clearly a way to separate people who were desperate to make money in hard economic times from their own cash and to get it into the pocket of Mr. Trump and his cronies,  Schneiderman said.The secret Trump University documents have revealed that workers at the operation were given a step-by-step manual on how to convince prospective  students  to give the company access to their money and also explained how to prey on their emotions in pursuit of profits. Trump University is now defunct, after Trump and his partners made money off of regular people, all while egging students on to profit from the 2007-8 real estate collapse.Featured image via YouTube",News,"May 31, 2016",0
Pennsylvania $2 bln budget gap is 'time bomb': governor,"NEW YORK (Reuters) - Pennsylvania’s $2 billion budget deficit is a “time bomb” that could cause “fiscal catastrophe the likes of which we have never seen” if it is not resolved, Governor Tom Wolf said in his budget address on Tuesday. Wolf proposed a $32.7 billion fiscal 2017 budget that would add $200 million of funding for K-12 public schools and another $110 million to early and special education programs. Including pension contributions, the budget would be nearly $33.3 billion. To pay for the increases, Wolf would increase personal income taxes by nearly 11 percent to 3.4 percent, expand sales taxes, raise taxes on tobacco products and implement a 6.5 percent severance tax on natural gas producers, according to documents released during his speech. But dominating Wolf’s message was the budgetary crisis escalated by political gridlock. Wolf, a Democrat, and the Republican-led legislature have disagreed since this time last year, when Wolf proposed his first budget. Now seven months after the start of fiscal 2016 on July 1, the state still has only a partial $23.4 billion emergency spending plan. Wolf had been ready to sign a negotiated $30.8 billion agreement but it was scuttled in December. Wolf reminded lawmakers of that turn of events on Tuesday. In web-streamed remarks, he urged them to send the agreement back to him. “House Republican leaders just walked away,” he said during his speech at the state capitol in Harrisburg. Some booed in response.  “Yelling will not make it go away,” Wolf said. “We need to do what’s right,” he continued, to applause. He later told lawmakers to “find another job” if they could not reach a solution. His 2017 proposal is built upon the eventual approval of that compromise budget for the current fiscal year.  Senate Republicans, who had passed the budget compromise, said Wolf was “doubling down” on last year’s proposal. “This retread budget proposal offers superficial changes to his sizable tax-and-spend plan that has already been soundly opposed by taxpayers,” Senate Majority Leader Jake Corman said in a statement on Tuesday. Unless next year’s deficit is closed, property taxes for homeowners will skyrocket, Wolf said. More than 23,000 teachers and school employees would be cut, as would special education and pre-kindergarten programs.  Services for senior citizens, the mentally ill, child care and domestic violence shelters also would be slashed, he said. Wolf’s address was no olive branch, said Muhlenberg College political scientist Christopher Borick.  “He turned up the heat,” Borick said. ",politicsNews,"February 9, 2016 ",1
Billionaire ‘Bilderberger’ David Rockefeller dead at 101," The Trilateral Commission is international and is intended to be the vehicle for multinational consolidation of the commercial and banking interests by seizing control of the political government of the United States. The Trilateral Commission represents a skillful, coordinated effort to seize control and consolidate the four centers of power   political, monetary, intellectual and ecclesiastical.      Senator Barry Goldwater, from his book  With No Apologies 21st Century Wire says Controversial globalist and banker David Rockefeller has died at 101 years of age.Rockefeller has been described as a philanthropist and banker, yet much of his legacy will forever be tied to the creation of the well-known think-tank the Council on Foreign Relations, The Trilateral Commission and his central role on the steering committee for the secretive Bilderberg Group established in 1954.The Bilderberg Group has often been passed off as an insignificant gathering of corporate CEO s, barons of oil, government top brass and royalty   most mainstream outlets still continue to mask the group s influence on foreign policy and world finance   but thankfully their exploits have been slowly uncovered with each passing year, as the list of attendees seem to change and grow with each new conference location.For those who still doubt there s a hidden element directing global interests, one only needs to look into the high-powered pursuits of Bilderberg attendees that have been linked to creating a multi-national sovereignty override through many transnational corporations with world trade partnerships like the Transatlantic partnership (TTIP) and Transpacific partnership (TPP), which now excludes the US via an executive order from Donald Trump.The following passage is from the NY Times: He spent his life in the club of the ruling class and was loyal to members of the club, no matter what they did,  The New York Times columnist David Brooks wrote in 2002, citing the profitable deals Mr. Rockefeller had cut with  oil-rich dictators,   Soviet party bosses  and  Chinese perpetrators of the Cultural Revolution. There was also an immense sphere of influence held by various power-hungry groups such as The Trilateral Commission, brought to fruition in 1973 by David Rockefeller and perennial foreign policy advisor Zbigniew Brzezinski. The Commission was also joined by fellow Bilderberg attendee and longtime policy advisor Henry Kissinger. Contrary to what most people think   the vast majority of The Trilateral Commission s members have been from countries outside of America.Rockefeller, like George Soros, is ultimately tied to globalism and vast social engineering programs.More from RT below  (Photo Illustration 21WIRE s Shawn Helton)Billionaire banker David Rockefeller dies aged 101RTRockefeller died in his sleep at home in Pocantico Hills, New York, on Monday morning as a result of congestive heart failure, according to a family spokesperson Fraser P. Seitel.The businessman, who had an estimated fortune of $3 billion, retired as head of Chase Manhattan in 1981 after a 35-year career.In the statement from the The Rockefeller Foundation confirming his death, Rockefeller was described as  one of the most influential figures in the history of American philanthropy and finance, considered by many to be  America s last great international business statesman .   Rockefeller, also known as  the banker s banker , according to the statement, is said to have donated almost $2 billion over his lifetime to various institutions including Rockefeller University, Harvard University and art museum.David was the youngest of six children born to John D. Rockefeller Jr. and the grandson of Standard Oil co-founder John D. Rockefeller.Rockefeller graduated from Harvard in 1936 and received a doctorate in economics from the University of Chicago in 1940. Appointed president of Chase Manhattan in 1961, he became chairman and CEO eight years later.RT continues here READ MORE ON SOCIAL ENGINEERING: 21st Century Wire Social Engineering FilesSUPPORT 21WIRE  SUBSCRIBE & BECOME A MEMBER @21WIRE.TV",Middle-east,"March 20, 2017",0
BOOM! TOMI LAHREN’S Top Tips For Liberals In 2017 [VIDEO], ,politics,"Dec 31, 2016",0
"Stung by reputation, Taiwan looks to turn corner on money laundering","TAIPEI (Reuters) - After Taiwan s state-run Mega Financial Holding Co was fined $180 million by U.S. authorities for lax enforcement of anti-money-laundering rules at its New York branch, the bank started a rigorous training program for its staff. Now, like Mega Financial, companies across Taiwan are working to get staff and systems up to speed after the island passed laws to meet international standards on combating money laundering and was taken off a watchlist by the Asia Pacific Group on Money Laundering (APG).  Unfortunately, Taiwan has earned a name for itself as a paradise for money laundering,  Deputy Justice Minister Tsai Pi-chung told Reuters. Money laundering and cybercrime connections to Taiwan, which is also in the process of pushing through a cyber security bill, have grabbed global headlines. U.S. authorities fined Mega Financial $180 million last year for lax enforcement of anti-money-laundering rules at its New York branch. Some money from the $170 million cyber heist of India s Union Bank of India was transferred through Taiwan s Bank SinoPac. An international crime ring used malware to steal $2.6 million from the ATMs of Taiwan s First Bank. Taiwan was one of the six most targeted countries of the Wannacry ransomware attack earlier this year, according to security company Avast.  Since 2011, 800 people from China and Taiwan have been deported from Cambodia on suspicion of telecoms fraud. Following its U.S. fine, Mega Financial said cleaning up its act is a top priority. U.S. authorities had said the Mega branch had been  indifferent  to the risks associated with transactions involving Panama, a high-risk area for money laundering.  What happened at our New York branch was just terrible,  said Robert Tsai, a senior executive vice president, referring to the fine and ensuing scandal.  Half of our 6,000 clerks have been certified with anti-money laundering training. How each of our branches implements the rules and ensures proper training is the top priority for our business.  To gain international confidence in its anti-money laundering measures, Taiwan will have to demonstrate it is putting the laws into practice. The APG will review Taiwan in 2018.  The visit will focus on how effectively Taiwan will have actually implemented the anti-money laundering rules,  said Liang Hung-lieh, partner of PricewaterhouseCoopers Taiwan.  The APG s on-site review will be new to most of the assessed, including banks, non-bank financial institutions and in particular non-financial institutions such as lawyers, public certified accountants and other professional service providers.  Under the anti-money laundering laws, these financial professionals will be required to report suspicious transactions, including bank transfers exceeding T$500,000 (US$16,500). They will have to determine where the money came from, provide details about the client and report that to Taiwan s newly established Anti-Money Laundering Office. These are similar to regulations that countries that have signed up to global anti-money laundering rules overseen by the Financial Action Task Force (FATF) have adopted. The cost to companies of implementing the new rules may be significant as they put processes, workers and data systems in place.  There s a lot of extra work for them to do now, such as determining the identities of their clients  beneficiaries,  said an official with the Financial Supervisory Commission, the island s financial regulator. He declined to be identified in the absence of permission to speak to the media.  They don t yet know exactly what they have to do, and to what extent, to be considered compliant with the new regulations. They re going to need some time to digest all of these new rules,  he said. The potential costs and increased difficulty of getting transactions done under the new rules worry those in the property market, said Wong Jui-chi, the spokesman for Taiwan s Chinese Association of Real Estate brokers, while emphasizing that his industry intends to fully comply with the regulations.  The property market is already in a bad shape and these new rules will make things worse by making the process of real estate transactions more complicated. More or less everyone in our industry is complaining about it,  he said. ",worldnews,"August 30, 2017 ",1
